{"account_username_sha256":"809cd2b0e14ad028438ad5a0a7af801dce013a86a3f1d62926a605177198389b","cache_invalidation":"pass","fixture_bytes":4096,"fixture_sha256":"ebe7ae6e4ba03727e54378c3e5182035a2ebfa2d5960b6d9c517a46d2e020277","free_bytes":1073741819824,"minimum_allocated_bytes":1000000000000,"observed_total_bytes":1073741824000,"operations":["about","lsjson","copyto","cat","moveto","deletefile","rmdir"],"original_file_size":"pass","password_reauthentication":"pass","range_count":1024,"range_offset":1024,"remote_cleanup":"pass","replace_existing_draft":"configured","state":"qualified","trash_cleanup":"manual-only","used_bytes":4176,"verified_at":"2026-08-26T00:42:08Z","version":1}
